NCT02318914,"9 May 2016","A 2-Year, Open-Label, Safety Extension Study of Gevokizumab in Subjects With Pyoderma Gangrenosum","A 2-Year, Open-Label, Safety Extension Study of Gevokizumab in Patients With Pyoderma Gangrenosum",,"XOMA (US) LLC",08/12/2014,"  20141208","10/03/2025 17:03:09",ClinicalTrials.gov,https://clinicaltrials.gov/show/NCT02318914,"Not recruiting",No,"18 Years",N/A,Both,01/11/2014,15,Interventional,"Endpoint Classification: Safety Study, Intervention Model: Single Group Assignment, Masking: Open Label, Primary Purpose: Treatment","Phase 3","United States;Australia;Canada;Australia;Canada;United States",,,,,,,"<br>    Inclusion Criteria:<br><br>     - Individuals who participated in a previous study of gevokizumab in PG<br><br>     - A clinical diagnosis of classic pyoderma gangrenosum<br><br>     - Contraceptive measures adequate to prevent pregnancy during the study<br><br>    Exclusion Criteria:<br><br>     - Clinical evidence of acutely infected pyoderma gangrenosum<br><br>     - History of allergic or anaphylactic reactions to monoclonal antibodies<br><br>     - History of recurrent or chronic systemic infections<br><br>     - Female subjects who are pregnant, planning to become pregnant, have recently<br>       delivered, or are breast-feeding<br><br>    Other protocol-defined inclusion/exclusion criteria may apply<br>   ",,"Pyoderma Gangrenosum","Drug: gevokizumab","Evaluation of treatment-emergent adverse events;;Changes from baseline vital signs, physical examination results, and laboratory test results;Changes from baseline concomitant medications use",,X052171,"Please refer to primary and secondary sponsors",,,,,,,,,,,,,,,,,,,,No,False,"          "
NCT02315417,"9 May 2016","An Efficacy and Safety Study of Gevokizumab in Treating Active Ulcers of Pyoderma Gangrenosum","A Randomized, Double-Blind, Placebo-Controlled Study of the Efficacy and Safety of Gevokizumab in Treating Active Ulcers of Pyoderma Gangrenosum",,"XOMA (US) LLC",05/12/2014,"  20141205","10/03/2025 17:03:09",ClinicalTrials.gov,https://clinicaltrials.gov/show/NCT02315417,"Not recruiting",No,"18 Years",N/A,Both,01/11/2014,16,Interventional,"Allocation: Randomized, Endpoint Classification: Safety/Efficacy Study, Intervention Model: Parallel Assignment, Masking: Double Blind (Subject, Caregiver, Investigator, Outcomes Assessor), Primary Purpose: Treatment","Phase 3","United States",,,,,,,"<br>    Inclusion Criteria:<br><br>     - A clinical diagnosis of classic pyoderma gangrenosum<br><br>     - An active pyoderma gangrenosum ulcer<br><br>     - Contraceptive measures adequate to prevent pregnancy during the study<br><br>    Exclusion Criteria:<br><br>     - Clinical evidence of acutely infected pyoderma gangrenosum<br><br>     - History of allergic or anaphylactic reactions to monoclonal antibodies<br><br>     - History of recurrent or chronic systemic infections<br><br>     - Female subjects who are pregnant, planning to become pregnant, have recently<br>       delivered, or are breast-feeding<br><br>    Other protocol-defined inclusion/exclusion criteria may apply<br>   ",,"Pyoderma Gangrenosum","Drug: gevokizumab;Drug: Placebo;Drug: gevokizumab open-label","The proportion of subjects at Day 126 with complete closure of the PG target ulcer confirmed 2 weeks later (at Day 140) and without the need for rescue treatment","The proportions of subjects at Day 126 with a reduction in the target ulcer area of = 75% or = 90% from baseline.",X052172,"Please refer to primary and secondary sponsors",,,,,,,,,,,,,,,,,,,,No,False,"          "
NCT01965613,"8 September 2025","A Phase II Open Label Study of Xilonix in Subjects With Pyoderma Gangrenosum","A Phase II Open Label Study of Xilonix in Subjects With Pyoderma Gangrenosum",,"Janssen Research & Development, LLC",15/10/2013,"  20131015","10/03/2025 17:03:09",ClinicalTrials.gov,https://clinicaltrials.gov/study/NCT01965613,"Not recruiting",No,"18 Years",N/A,All,31/01/2014,10,Interventional,"Allocation: N/A. Intervention model: Single Group Assignment. Primary purpose: Treatment. Masking: None (Open Label). ","Phase 2","United States"," ","Janssen Research & Development, LLC Clinical Trial",,,,"Janssen Research & Development, LLC","Inclusion Criteria:<br><br> 1. Age: =18<br><br> 2. History of pyoderma gangrenosum with or without other systemic disease.<br><br>Exclusion Criteria:<br><br> 1. Treatment with any biologicals (including intravenous immunoglobulin) or<br>   investigational agents within the last 4 weeks (or 5 half-lives, whichever is<br>   longer).<br><br> 2. Treatment with corticosteroids or cyclosporine within the last 2 weeks.",,"Pyoderma Gangrenosum","Biological: Xilonix","Change in Physician's Wound Assessment & Patient's Global Assessment",,2013-PT025,"Please refer to primary and secondary sponsors",,,,,,,,,,,,,,,,,,,,Yes,False,"          "
NCT01952275,"10 October 2016","Observational Study of the Genetic Architecture of Neutrophil-Mediated Inflammatory Skin Diseases","Assessment of the Enrichment of Rare Coding Genetic Variants in Patients Affected by Neutrophil-Mediated Inflammatory Dermatoses",NEUTROGENE,"University of Zurich",17/09/2013,"  20130917","10/03/2025 17:03:09",ClinicalTrials.gov,https://clinicaltrials.gov/show/NCT01952275,Recruiting,No,N/A,"120 Years",Both,01/01/2014,600,Observational,"Observational Model: Case-Only, Time Perspective: Cross-Sectional",N/A,Switzerland;Switzerland," ; ; ; ","Alexander Navarini, MD;Alexander Navarini, MD;Alexander Navarini, MD;Alexander Navarini, MD",,;alexander.navarini@usz.ch;;alexander.navarini@usz.ch,;;;,"University Hospital Zurich, Dept. of Dermatology;;University Hospital Zurich, Dept. of Dermatology;","<br>    Inclusion criteria:<br><br>     - History of NMID or active disease.<br><br>     - Informed consent.<br><br>    Exclusion criteria:<br><br>    - No consent to either part of the study.<br>   ;<br>    Inclusion criteria:<br><br>     - History of NMID or active disease.<br><br>     - Informed consent.<br><br>    Exclusion criteria:<br><br>    - No consent to either part of the study.<br>   ",,"Other Specified Inflammatory Disorders of Skin or Subcutaneous Tissue;Pyoderma Gangrenosum;Erosive Pustular Dermatosis of the Scalp;Sweet's Syndrome;Behcet's Disease;Bowel-associated Dermatosis-arthritis Syndrome;Pustular Psoriasis;Acute Generalized Exanthematous Pustulosis;Keratoderma Blenorrhagicum;Sneddon-Wilkinson Disease;IgA Pemphigus;Amicrobial Pustulosis of the Folds;Infantile Acropustulosis;Transient Neonatal Pustulosis;Neutrophilic Eccrine Hidradenitis;Rheumatoid Neutrophilic Dermatitis;Neutrophilic Urticaria;Still's Disease;Erythema Marginatum;Unclassified Periodic Fever Syndromes / Autoinflammatory Syndromes;Dermatitis Herpetiformis;Linear IgA Bullous Dermatosis;Bullous Systemic Lupus Erythematosus;Inflammatory Epidermolysis Bullosa Aquisita;Neutrophilic Dermatosis of the Dorsal Hands (Pustular Vasculitis);Small Vessel Vasculitis Including Urticarial Vasculitis;Erythema Elevatum Diutinum;Medium Vessel Vasculitis;Other Specified Inflammatory Disorders of Skin or Subcutaneous Tissue;Pyoderma Gangrenosum;Erosive Pustular Dermatosis of the Scalp;Sweet's Syndrome;Behcet's Disease;Bowel-associated Dermatosis-arthritis Syndrome;Pustular Psoriasis;Acute Generalized Exanthematous Pustulosis;Keratoderma Blenorrhagicum;Sneddon-Wilkinson Disease;IgA Pemphigus;Amicrobial Pustulosis of the Folds;Infantile Acropustulosis;Transient Neonatal Pustulosis;Neutrophilic Eccrine Hidradenitis;Rheumatoid Neutrophilic Dermatitis;Neutrophilic Urticaria;Still's Disease;Erythema Marginatum;Unclassified Periodic Fever Syndromes / Autoinflammatory Syndromes;Dermatitis Herpetiformis;Linear IgA Bullous Dermatosis;Bullous Systemic Lupus Erythematosus;Inflammatory Epidermolysis Bullosa Aquisita;Neutrophilic Dermatosis of the Dorsal Hands (Pustular Vasculitis);Small Vessel Vasculitis Including Urticarial Vasculitis;Erythema Elevatum Diutinum;Medium Vessel Vasculitis","Procedure: Collection of biological samples;Procedure: Collection of biological samples","Enrichment of rare coding genetic variants;Enrichment of rare coding genetic variants",,USZ-DER-AAN-019;USZ-DER-AAN-019,"Please refer to primary and secondary sponsors;Please refer to primary and secondary sponsors",,,,,,,,,,,,,,,,,,,,Yes,False,"          "
NCT01882504,"15 February 2016","Proof of Concept Study of Gevokizumab in the Treatment of Pyoderma Gangrenosum","An Open-label, Proof of Concept Study of Gevokizumab in the Treatment of the Acute, Inflammatory Phase of Pyoderma Gangrenosum",,"XOMA (US) LLC",17/06/2013,"  20130617","10/03/2025 17:03:09",ClinicalTrials.gov,https://clinicaltrials.gov/show/NCT01882504,"Not recruiting",No,"18 Years",N/A,Both,01/05/2013,8,Interventional,"Endpoint Classification: Safety/Efficacy Study, Intervention Model: Single Group Assignment, Masking: Open Label, Primary Purpose: Treatment","Phase 2","United States",,,,,,,"<br>    Inclusion Criteria:<br><br>     - An established diagnosis of pyoderma gangrenosum<br><br>     - Currently experiencing an inflammatory episode of pyoderma gangrenosum<br><br>     - Contraceptive measures adequate to prevent pregnancy during the study<br><br>    Exclusion Criteria:<br><br>     - Clinical evidence of acutely infected pyoderma gangrenosum<br><br>     - History of allergic or anaphylactic reactions to monoclonal antibodies<br><br>     - History of recurrent or chronic systemic infections<br><br>     - Female subjects who are pregnant, planning to become pregnant, have recently<br>       delivered, or are breast-feeding<br><br>    Other protocol-defined inclusion/exclusion criteria may apply<br>   ",,"Pyoderma Gangrenosum","Drug: gevokizumab","Improvement in the Investigator's Assessment of the pyoderma gangrenosum target ulcer",,X052170,"Please refer to primary and secondary sponsors",,,,,,,,,,,,,,,,,,,,No,False,"          "
EUCTR2011-002920-41-DE,"8 August 2022","Stelara® (Ustekinumab) treatment in Patients with Pyoderma gangrenosum","Open-label Trial of Stelara® (Ustekinumab) In Patients with Pyoderma gangrenosum – an open, non-placebo controlled pilot study with 10 patients. - SPG-Trial                                                                                                                                                                                                                                                                                                                                                                                                                                                                                                                                                                                                                                                                                                                                                                                                                                                                                                                                                         ",,"University Hospital Tübingen",24/08/2011,"  20110824","10/03/2025 17:03:09","EU Clinical Trials Register",https://www.clinicaltrialsregister.eu/ctr-search/search?query=eudract_number:2011-002920-41,"Not Recruiting",No,,,"<br>Female: yes<br>Male: yes<br>",04/01/2012,10,"Interventional clinical trial of medicinal product","Controlled: no<br>Randomised: no<br>Open: no<br>Single blind: no<br>Double blind: no<br>Parallel group: no<br>Cross over: no<br>Other: no<br>If controlled, specify comparator, Other Medicinial Product: no<br>Placebo: no<br>Other: no<br>","Human pharmacology (Phase I): no
Therapeutic exploratory (Phase II): yes
Therapeutic confirmatory - (Phase III): no
Therapeutic use (Phase IV): no
",Germany,"Coordinating Investigator",,"Liebermeisterstr. 25",tilo.biedermann@med.uni-tuebingen.de,"00490707129 80836","University Department of Dermatology","Inclusion criteria: <br>1.Clinical diagnosis of PG, previously systemically untreated (with the exception of systemic corticosteroids)<br><br>2.Measurable disease parameters of PG (color photograph with a ruler).<br><br>3.Patients >= 18 years of age<br><br>4.Female patients of childbearing potential must have negative pregnancy test within 7 days before initiation of study drug dosing. Postmenopausal women must be amenorrheic for at least 12 months to be considered of non-childbearing potential. Male and female patients of reproductive potential must agree to employ an effective barrier method of birth control throughout the study and for up to 3 months following discontinuation of study drug.<br><br>5.Written, voluntary informed consent. Consent must include investigational use of parts of the obtained tissue material. <br><br>6.Screening laboratory test results within the following parameters:<br>-Haemoglobin=10g/dL<br>-White blood cells=3.5 x 109/L<br>-Neutrophils=1.5 x 109/L<br>-Platelets=100 x 109/L<br>-Serum creatinine = 1.5 mg/dL (or = 133 mol/L)<br>-Aspartate aminotransferase (AST), alanine aminotransferase (ALT) and alkaline phosphatase levels must not exceed three times the upper limit of the normal range for laboratory conducting the test.<br>7.Eligible according the tuberculosis (TB) criteria<br><br>Are the trial subjects under 18? no<br>Number of subjects for this age range: <br>F.1.2 Adults (18-64 years) yes<br>F.1.2.1 Number of subjects for this age range 10<br>F.1.3 Elderly (>=65 years) yes<br>F.1.3.1 Number of subjects for this age range 10<br>","Exclusion criteria: <br>1.Female patients who are pregnant or breast-feeding.<br><br>2.Known diagnosis of human immunodeficiency virus (HIV) infection, Hepatitis B or Hepatitis C.<br><br>3.Diagnosed with active or latent TB infection during screening.<br><br>4.Any significant history of non-compliance to medical regimens or with inability to grant reliable informed consent.<br><br>5.Currently receiving any other biologic agent.<br><br>6.Have previously failed treatment with any therapeutic agent with the exception of systemic corticosteroids.<br><br>7. Have previously received any treatment agent directly targeted at reducing IL-12 and/or IL-23.<br><br>8.Have received, within 2 weeks prior to the first dose of ustekinumab, a live virus or bacterial vaccination.<br><br>9.Have received, or are expected to receive, a BCG vaccination within 12 months prior to screening, during study, or within 12 months after the last administration of study agent.<br><br>10.Have a serious infection (eg sepsis, pneumonia or pyelonephritis).<br><br>11.Have a transplanted organ (with exception of a corneal transplantat in situ).<br><br>12.Have a known history of lymphoproliferative disease.<br><br>13.Have any known malignancies or have history of malignancy (with the exception of basal cell carcinoma, squamous cell carcinoma with tumor thickness =2mm, or cervical carcinoma in situ that has been treated with no evidence of reccurence within 1 year prior to the first administration of study agent).<br><br>14.Have a known hypersenstitivity to ustekinumab or any of its excipients.<br><br>15.Is a prisoner<br><br>16.Participation in another clinical trial whilst this study or within the last 30 days preliminary to this study<br><br>17.Have any condition that, in the opinion of the investigator, would compromise the well being of the patient or the study.<br><br>","Patients with a clinical diagnosis of Pyoderma gangrenosum <br>MedDRA version: 14.1Level: LLTClassification code 10037634Term: Pyoderma gangenosumSystem Organ Class: 10040785 - Skin and subcutaneous tissue disorders;Therapeutic area: Analytical, Diagnostic and Therapeutic Techniques and Equipment [E] - Therapeutic techniques [E02]","<br>Trade Name: Stelara<br>Product Name: Ustekinumab<br>Pharmaceutical Form: Solution for injection<br>CAS Number: 815610-63-0<br>Other descriptive name: USTEKINUMAB<br>Concentration unit: mg milligram(s)<br>Concentration type: range<br>Concentration number: 45-90<br><br>","Main Objective: To confirm the efficacy and immunological response of Stelara® therapy in patients with PG;Primary end point(s): Change of the PG-inflammation SCORE from baseline to week 28;Timepoint(s) of evaluation of this end point: week 28 ;Secondary Objective: - To assess changes in PG-inflammation Score, Wound Score and Visual Analogue Pain Scale (VAPS).  <br><br>- To assess the safety and tolerability of Stelara in patients with PG. <br><br>- To assess, where feasible, the functional significance of the expression pattern of inflammatory cytokines, particularly IL-23, in PG tissue as obtained by biopsies before the beginning of and after the treatment with Stelara and by blood samples before, during and after treatment with Stelara<br>•Evaluation of the expression of these cytokines and/or associated inflammatory molecules<br>•Assessment of the type of Th immune response before, during and after treatment with Stelara<br>•Correlation of the results from the analyses mentioned above with the clinical outcome of PG patients.<br><br>- To asses changes in quality of life, including the dermatology Life Quality Index (DLQI)<br>","Secondary end point(s): - Change of PG-adapted RECIST criteria <br>- Wound Score and Visual Analogue Pain Scale from baseline to week 28<br>- The incidence and grading of adverse events and abnormal laboratory cytometry<br>- Cytokine expression of monocytes and T-cells <br>- Cytokine and immunohistological studies to analyze the cytokine profile in the punch biopsies of PG patients under Stelara® therapy <br>- Analysis of the phenotype and intracellular cytokine profile of Mononuclear cells and lymphocytes. ;Timepoint(s) of evaluation of this end point: week 16 and 28 ",StelaraPG01,"Janssen-Cilag GmbH",,Approved,27/12/2011,,,,,,,,,,,,"No results available","No results available","No results available",,,Yes,False,"          "
