NCT04274166,"7 June 2021","Secukinumab for the Inflammatory Phase of Pyoderma Gangrenosum","The Efficacy and Safety of Secukinumab for the Inflammatory Phase of Pyoderma Gangrenosum",,"Wake Forest University Health Sciences",12/02/2020,"  20200212","10/03/2025 17:03:09",ClinicalTrials.gov,https://clinicaltrials.gov/show/NCT04274166,"Not recruiting",No,"18 Years","75 Years",All,01/05/2021,0,Interventional,"Allocation: N/A. Intervention model: Single Group Assignment. Primary purpose: Treatment. Masking: None (Open Label). ","Phase 2","United States"," ","William W Huang, MD. MPH",,,,"Wake Forest University Health Sciences","<br>    Inclusion Criteria:<br><br>    1. Must give written informed consent. 2. Has a diagnosis of pyoderma gangrenosum, as<br>    determined by the investigator based on the following diagnostic criteria4:<br><br>    a. Diagnosis requires both major criteria and at least two minor criteria i. Major criteria<br><br>     1. Rapid progression of a painful, necrolytic cutaneous ulcer with an irregular,<br>       violaceous, and undermined border<br><br>     2. Other causes of cutaneous ulceration have been excluded ii. Minor criteria<br><br>    1. History suggestive of pathergy or clinical finding of cribriform scarring 2. Systemic<br>    diseases associated with PG 3. Histopathologic findings (sterile dermal neutrophilia, ±<br>    mixed inflammation, ± lymphocytic vasculitis) 4. Treatment response (rapid response to<br>    systemic steroid treatment)<br><br>    3. PG global assessment of moderate to severe, with at least one ulcer measuring at least 3<br>    cm in diameter.<br><br>    4. 18 years of age or greater. 5. Must require systemic therapy for their pyoderma<br>    gangrenosum, as determined by the investigator prior to Baseline. Currently prescribed<br>    low-dose corticosteroids (= 10 mg/day), and other medications within one week prior to<br>    investigational drug administration, may be continued with no change in dose or frequency<br>    during the study.<br><br>    Exclusion Criteria:<br><br>     1. Female subjects who are not postmenopausal for at least 1 year, surgically sterile, or<br>       willing to practice effective contraception during the study. Nursing mothers,<br>       pregnant women and women planning to become pregnant while on study are to be<br>       excluded.<br><br>     2. Current enrollment in any investigational study in which the subject is receiving any<br>       type of drug, biologic, or non-drug therapy (participation in registry-type studies is<br>       allowed).<br><br>     3. Serious local infection (e.g., cellulitis, abscess) or systemic infection (e.g.,<br>       pneumonia, septicemia) within the 3 months prior to the first dose of investigational<br>       drug.<br><br>     4. Treatment with another investigational drug or approved therapy for investigational<br>       use within 28 days prior to investigational drug administration.<br><br>     5. Treatment with high dose (>10 mg/day) systemic steroids (prednisone) within one week<br>       prior to investigational drug administration. Treatment with cyclosporine,<br>       thalidomide, methotrexate, mycophenolate mofetil, azathioprine, or other systemic<br>       immunosuppressant agents within the 14 days prior to investigational drug<br>       administration (requirement of a 2-week washout).<br><br>     6. Known HIV+, known viral hepatitis infection, known tuberculosis infection.<br><br>     7. Any subject with a current or history of a malignancy in the last five years<br>       (excluding treated basal cell carcinoma).<br><br>     8. Clinically significant abnormal laboratory measures at screening.<br><br>     9. Known Irritable Bowel Disease-associated PG<br>   ",,"Pyoderma Gangrenosum","Drug: secukinumab 150 mg (2 injections per dose","Efficacy - Investigator Global Assessment (IGA);Efficacy - Investigator Global Assessment (IGA);Efficacy - Investigator Global Assessment (IGA);Efficacy - Investigator Global Assessment (IGA);Efficacy - Investigator Global Assessment (IGA);Efficacy - Investigator Global Assessment (IGA);Efficacy - Investigator Global Assessment (IGA);Efficacy - Investigator Global Assessment (IGA);Efficacy - Investigator Global Assessment (IGA);Efficacy - Subject Global Assessment (SGA);Efficacy - Subject Global Assessment (SGA);Efficacy - Subject Global Assessment (SGA);Efficacy - Subject Global Assessment (SGA);Efficacy - Subject Global Assessment (SGA);Efficacy - Subject Global Assessment (SGA);Efficacy - Subject Global Assessment (SGA);Efficacy - Subject Global Assessment (SGA);Efficacy - Ulcer Lesion Assessment PG Target Lesion;Efficacy - Ulcer Lesion Assessment PG Target Lesion",,Huang_IIT_CAIN457AUS24T;IRB00063109,"Please refer to primary and secondary sponsors",Novartis,,,,,,,,,,,,,,,,,,,Yes,False,"          "
DRKS00017390,"7 April 2025","Breakdown, Identification and Observation of the microenvironment of acute and chronic wounds","Breakdown, Identification and Observation of the microenvironment of acute and chronic wounds - Wound-BIOME                                                                                                                                                                                                                                                                                                                                                                                                                                                                                                                                                                                                                                                                                                                                                                                                                                                                                                                                                                                   ",,"Institut für Translationale Wundforschung, Zentrum für biomedizinische Ausbildung und Forschung (ZBAF), Universität Witten/Herdecke",10/07/2019,"  20190710","10/03/2025 17:03:09","German Clinical Trials Register",http://drks.de/search/en/trial/DRKS00017390,Recruiting,No,"18 Years",None,All,18/04/2018,160,observational,"Allocation: ; Masking: ; Control: ; Assignment: ; Study design purpose: basic science  ",,Germany,Julian-Dario,Rembe,"Stockumer Str. 10",julian-dario.rembe@uni-wh.de,+491626368722,"Institut für Translationale Wundforschung, Zentrum für biomedizinische Ausbildung und Forschung (ZBAF), Universität Witten/Herdecke","Inclusion criteria: 1. Men and women, aged 18 years or older<br>2. Signed informed consent<br>3. Existing wound for longer than 8 weeks ('chronic')<br>OR<br>4. Existing wound for over 24 hours and less than 6 days after traumatic event or surgical intervention ('acute')","Exclusion criteria: 1. Dry necrosis, dry wound bed, no wound bed sampling possible<br>2. Aged < 18 years<br>3. Pregnancy or nursing period<br>4. Wound of malignant entity (e.g. exulcerating tumor)<br>5. Non written consent","acute woundschronic wounds","Group 1: Acute, non-infected wounds (control group; observative, non-interventionell)<br><br>As part of the regular medical wound treatment, sterile wound swabs are obtained from the wound bed of open acute and chronic wounds for biomaterial acquisition. <br>Subsequently, this material is analyzed regarding protein signature, gene expression patterns and microbial occurrence and correlated with the wounds healing stage as well as between acute and chronic wounds. <br>Group 2: diabetic ulceration<br><br>Group 3: arterial ulceration<br>Group 4: venous ulceration<br>Group 5: decubital ulceration<br>Group 6: pyoderma gangrenosum<br>Group 7: other chronic wounds","Goal criterion: Acquisition of biological material for biomolecular analysis of chronic wound entities compared to acute wounds for correlation with healing phase and progression.<br><br>Sampling endpoint is marked by complete wound closure/epithelization making further wound bed swabbing impossible. ",,U1111-1233-9304,"Institut für Translationale Wundforschung, Zentrum für biomedizinische Ausbildung und Forschung (ZBAF), Universität Witten/Herdecke",,Approved,22/03/2018,"Ethik-Kommission der Universität Witten/Herdecke","Alfred-Herrhausen-Str. 50 58448 Witten Germany",+49-2302-926740,sekretariat-ethik@uni-wh.de,,,http://drks.de/search/en/trial/DRKS00017390#studyResults,http://drks.de/search/en/trial/DRKS00017390#studyProtocols,,,,http://drks.de/search/en/trial/DRKS00017390#basicReporting,http://drks.de/search/en/trial/DRKS00017390#basicReporting,http://drks.de/search/en/trial/DRKS00017390#basicReporting,No,,No,False,"          "
NCT03971643,"18 September 2023","Exploratory Study of IFX-1 in Patients With Pyoderma Gangrenosum","Open Label Exploratory Phase IIa Trial to Investigate the Safety and Efficacy of IFX-1 in Treating Patients With Pyoderma Gangrenosum (OPTIMA)",,"InflaRx GmbH",28/05/2019,"  20190528","10/03/2025 17:03:09",ClinicalTrials.gov,https://clinicaltrials.gov/ct2/show/NCT03971643,"Not recruiting",No,"18 Years",N/A,All,16/05/2019,19,Interventional,"Allocation: Non-Randomized. Intervention model: Single Group Assignment. Primary purpose: Treatment. Masking: None (Open Label). ","Phase 2","United States;Canada;Poland;Canada;Poland;United States"," ","Prof. Niels C. Riedemann, M.D., Ph.D.",,,,"InflaRx GmbH","<br>    Inclusion Criteria:<br><br>     - Diagnosis of an ulcerative form of pyoderma gangrenosum confirmed by the investigator<br><br>    In addition, the subject must fulfill at least 3 of the following 6 criteria at screening:<br><br>    History of<br><br>     - Pathergy (ulcer occurring at the sites of trauma)<br><br>     - Personal history of inflammatory bowel disease or inflammatory arthritis<br><br>     - History of papule, pustule or vesicle that rapidly ulcerated<br><br>    Clinical examination (or photographic evidence) of<br><br>     - Peripheral erythema, undermining border, and tenderness at site of ulceration<br><br>     - Multiple ulcerations (at least 1 occurring on the lower leg)<br><br>     - Cribriform or """"wrinkled paper"""" scar(s) at sites of healed ulcers<br><br>    Subject has a minimum of 1 evaluable ulcer (=2 cm2) on the lower extremity at screening<br><br>    Exclusion Criteria:<br><br>     - Pyoderma gangrenosum target ulcer for more than 3 years before screening<br><br>     - Surgical wound debridement within the previous 2 weeks before screening<br><br>     - Use of intravenous antibacterials, antivirals, anti-fungals, or anti-parasitic agents<br>       within 30 days before screening<br><br>     - Any drug treatment for pyoderma gangrenosum including corticosteroids (>10 mg),<br>       intralesional steroids, cyclosporine A, biologicals and immunosuppressives (with the<br>       exception of antibiotics for wound superinfection) used within a time of 5 half-lives<br>       of the drug before screening<br>   ",,"Pyoderma Gangrenosum","Drug: vilobelimab","Treatment-emergent Adverse Events (TEAEs), Related TEAEs, Serious TEAEs, and Adverse Events of Special Interest (AESIs)","Number of Patients With Physician's Global Assessment (PGA) Score =3 (Investigator Assessment);Time to Complete Closure of Pyoderma Gangrenosum Target Ulcer (Investigator Assessment) [Days];Percentage Change in Wound Healing (Wound Area) by Photographic Assessment;Percentage Change in Wound Healing (Wound Volume) by Photographic Assessment;Rate of Change Per Day in Area of Target Ulcer by Photographic Assessment From V1 to V16;Number of Patients With = 50% Decrease in Area of Target Ulcer by Photographic Assessment at V16;Number of Patients With 100% Decrease in Area of Target Ulcer at V16;Degree of Erythema of the Target Ulcer at V4, V6, V10 and V16;Border Elevation of the Target Ulcer at Visits V4, V6, V10 and V16;Percentage Change in Pain by Numeric Rating Scale (NRS) at Visits V4, V6, V10 and V16;Percentage Change in Life Quality by DLQI at Visits V4, V6, V10, and V16",IFX-1-P2.7,"Please refer to primary and secondary sponsors","Innovaderm Research Inc.",,,,,,,Yes,14/09/2023,https://clinicaltrials.gov/ct2/show/results/NCT03971643,,,,,,,,,,No,False,"          "
JPRN-jRCTs072180053,"18 July 2025","Study on Therapeutic effects of granulocyte adsorption column (Adacolumn) for pyoderma gangrenosum","Study on Therapeutic effects of granulocyte adsorption column (Adacolumn) for pyoderma gangrenosum - Therapeutic effects of granulocyte adsorption column                                                                                                                                                                                                                                                                                                                                                                                                                                                                                                                                                                                                                                                                                                                                                                                                                                                                                                                                                            ",,"Higashi Yuko",15/03/2019,"  20190315","10/03/2025 17:03:09",JPRN,https://jrct.mhlw.go.jp/latest-detail/jRCTs072180053,"Not Recruiting",No,">= 20age old","Not applicable",Both,09/11/2015,65,Interventional,"single arm study, open(masking not used), no treatment control/standard of care control, single assignment, treatment purpose",2,,Yuko,Higashi,"8-35-1 Sakuragaoka, Kagoshima City, Kagoshima",higashiy@m.kufm.kagoshima-u.ac.jp,+81-99-275-5388,"Kagoshima University Hospital","Inclusion criteria: Pyoderma gangrenosum","Exclusion criteria: Severe infection","Pyoderma gangrenosum <br>Pyoderma gangrenosum;Pyoderma gangrenosum","Therapy of granulocyte adsorption column","Reduction rate of skin ulcer area","Visual Analogue Scale, physician's global assessment",,,,Approval,13/03/2019,crmc@m2.kufm.kagoshima-u.ac.jp,crmc@m2.kufm.kagoshima-u.ac.jp,+81-99-275-6624,crmc@m2.kufm.kagoshima-u.ac.jp,Yes,31/03/2024,https://pubmed.ncbi.nlm.nih.gov/34369050/,https://jrct.mhlw.go.jp/latest-detail/jRCTs072180053,04/11/2023,09/08/2021,"Granulocyte and monocyte adsorption apheresis was performed for refractory skin ulcers in pyoderma gangrenosum. The achievement rate of skin ulcer area reduction was 68.4%. No serious adverseevents occurred.","Of the 35 cases performed, 15 were males and 20 were females, ranging in age from 21 to 81 years. All cases were treated with granulocyte and monocyte adsorption apheresis because of the single-open trial.","No serious adverse events occurred.","The primary endpoint of skin ulcer area reduction was 68.4%. Secondary endpoints were 3.1 +- 0.2 PGA before treatment and 2.1+- 0.2 after treatment. Pain VAS improved in all cases measured, regardless of effect. CRP was significantly reduced in the effective cases. Other counts such as white blood cell count, neutrophil count, monocyte count, and platelet count did not differ between pre- and post-treatment.",No,"Not applicable",No,False,"          "
NCT03636737,"12 December 2020","Study on the Clinical Features, Comorbidities and Pathologies Associated With Pyoderma Gangrenosum","Retrospective Multicenter Observational Study on the Clinical Features, Comorbidities and Pathologies Associated With Pyoderma Gangrenosum in Patients Diagnosed With This Pathology Between 2000 and 2015",PYODERMA,"Assistance Publique Hopitaux De Marseille",16/08/2018,"  20180816","10/03/2025 17:03:09",ClinicalTrials.gov,https://clinicaltrials.gov/show/NCT03636737,"Not recruiting",No,N/A,N/A,All,01/12/2018,140,Observational,,,France," ; ; ","EMILIE GARRIDO PRADALIE;PHILIPPE BERBIS, MD;PHILIPPE BERBIS, MD",,;Philippe.BERBIS@ap-hm.fr;Philippe.BERBIS@ap-hm.fr,";0491964962;+33 491964962",APHM;,"<br>    Inclusion Criteria:<br><br>     - 2 major criteria (typical clinical appearance with well-defined ulceration and<br>       purulent or pustule hutches, exclusion of differential diagnoses)<br><br>     - at least 2 minor criteria (among compatible histological aspect, classically<br>       compatible associated pathologies, corticosensitivity of the lesions, pathergie<br>       phenomenon, painful lesions).<br><br>    Exclusion Criteria:<br><br>     - patients with less than 2 major criteria<br><br>     - patients with less than 2 minor criteria<br>   ",,"Pyoderma Gangrenosum","Other: pathology associated","Number of patients",,RCAPHM17_0083,"Please refer to primary and secondary sponsors",,,,,,,,,,,,,,,,,,,,Yes,False,"          "
NCT03311464,"16 March 2021","A Study Assessing the Efficacy and Safety of Adalimumab in Active Ulcer(s) of Pyoderma Gangrenosum in Participants in Japan","A Phase 3 Multicenter, Open-Label, Single Arm Study of the Efficacy and Safety of Adalimumab in Active Ulcer(s) of Pyoderma Gangrenosum in Subjects in Japan",,AbbVie,12/10/2017,"  20171012","10/03/2025 17:03:09",ClinicalTrials.gov,https://clinicaltrials.gov/show/NCT03311464,"Not recruiting",No,"18 Years",N/A,All,27/10/2017,22,Interventional,"Allocation: N/A. Intervention model: Single Group Assignment. Primary purpose: Treatment. Masking: None (Open Label). ","Phase 3",Japan," ","AbbVie Inc.",,,,AbbVie,"<br>    Inclusion Criteria:<br><br>     - Participant must be able and willing to provide written informed consent. If the<br>       participant is < 20 years old, a parent or legal guardian must be willing to give<br>       written informed consent<br><br>     - Participants must have a diagnosis of ulcerative (classic) PG made by the Investigator<br><br>     - Participants must have demonstrated an inadequate response to conventional PG therapy<br>       or in the opinion of the Investigator they are not a suitable candidate for<br>       conventional PG treatment.<br><br>    Exclusion Criteria:<br><br>     - Participants with pustular, bullous/atypical, or vegetative variants of PG<br><br>     - Participants with clinical evidence of ulceration that is non-PG related, vasculitis,<br>       thrombosisprone conditions, or monoclonal gammopathy<br><br>     - Participants with a histopathological finding that is consistent with a diagnosis<br>       other than PG<br><br>     - Participants receiving a therapeutic dose of prednisolone<br><br>     - Participants with prior exposure to adalimumab or previous participation in an<br>       adalimumab clinical study.<br>   ",,"Pyoderma Gangrenosum","Drug: adalimumab","Proportion of participants who have achieved target Pyoderma Gangrenosum Area Reduction (PGAR)","Proportion of participants achieving Physician's Global Assessment (PGA) 0 or 1;Mean time to occurrence of new PG ulcers;Change from Baseline in total number of active ulcers;Change from Baseline in Dermatology Life Quality Index (DLQI);Changes from Baseline in total ulcer area;Proportion of participants with inflammation reduction as assessed on an Investigator Inflammation Assessment (IIA) Score;Mean time to occurrence of a new PG ulcer(s);Mean time to healing of target ulcer;Proportion of participants achieving healing per PGAR for the target ulcer;Proportion of participants who have achieved target PGAR;Percentage change in target Pyoderma Gangrenosum (PG) ulcer area;Proportion of participants achieving PGA 0;Change from Baseline in Pain as measured by Numerical Rating Scale (NRS);Changes from baseline in the proportion of participants taking analgesics;Velocities of healing;Proportion of participants achieving ulcer healing as assessed by PGAR;Proportion of participants achieving PGA 0 of all PG ulcers;Mean time to relapse of the target PG ulcer;Mean time to healing as defined by PGAR",M16-119,"Please refer to primary and secondary sponsors",,,,,,,,,,,,,,,,,,,,Yes,False,"          "
