NCT05821374,"8 September 2025","Deucravacitinib in PG","Novel Treatment of Pyoderma Gangrenosum With Deucravacitinib",,"Dartmouth-Hitchcock Medical Center",20/03/2023,"  20230320","10/03/2025 17:03:09",ClinicalTrials.gov,https://clinicaltrials.gov/study/NCT05821374,"Not recruiting",No,"18 Years","70 Years",All,29/04/2024,0,Interventional,"Allocation: N/A. Intervention model: Single Group Assignment. Primary purpose: Treatment. Masking: None (Open Label). ","Early Phase 1","United States"," ","Brian J. Simmons, MD",,,,"Dartmouth-Hitchcock Medical Center","Inclusion Criteria:<br><br> - Men and women between the ages of 18-70 years old<br><br> - Diagnosed with pyoderma gangrenosum requiring one major and at least 4 minor<br>   criteria<br><br> - Women must not be pregnant, lactating, or planning pregnancy during the study period<br><br> - Women of child-bearing potential must be on birth control for the duration of the<br>   treatment period.<br><br> - Subjects must agree to the use of at least one of the following contraception<br>   methods for the entire duration of the study until at least 30 days after taking<br>   their last dose of study drug:<br><br> - Women: Hormonal contraception (oral, injections, patch, implant, or vaginal-ring);<br>   Spiral (with or without hormones); any sterilization methods; a partner who has had<br>   a vasectomy; or sexual abstinence.<br><br> - Other acceptable methods of contraception are male or female condoms (with or<br>   without spermicide) or a cap, diaphragm, or sponge with spermicide.<br><br> - Willing to discontinue topical and/or systemic therapies, with the exception of oral<br>   rescue therapy with steroids.<br><br> - The wash period for systemic therapies will largely depend on the specific treatment<br>   but, in general, will be at least 6 months for biologics and 3 months for other<br>   immune- suppressants such as cyclosporine, mycophenolate mofetil, methotrexate, etc.<br>   No wash out period is required for topicals.<br><br> - Capable and willing to sign Institutional Review Board/IEC-approved written informed<br>   consent form in accordance with regulatory and institutional guidelines before the<br>   performance of any protocol-related procedures.<br><br>Exclusion Criteria:<br><br> - Patient under 18 years of age.<br><br> - Patients with a history of inflammatory bowel disease.<br><br> - Patients on systemic immunosuppressive/immune modulating therapy including: oral<br>   steroids, cyclosporine, mycophenolate mofetil, methotrexate, Azathioprine or TNFa<br>   inhibitor at time of starting deucravacitinib.<br><br> - Patients currently enrolled in another investigational study.<br><br> - Patients with a history or evidence of active infection and/or febrile illness<br>   within 7 days; or serious infection requiring antibiotic treatment within 30 days<br><br> - Hepatitis C virus (HCV): subjects known to be positive for anti-HCV antibody or for<br>   HCV RNA detectable by polymerase chain reaction (PCR)<br><br> - Hepatitis B virus (HBV): subjects known to be positive for hepatitis B surface<br>   antigen or for HBV DNA detectable by PCR<br><br> - Human Immunodeficiency Virus (HIV) infection: subjects known to be HIV positive<br><br> - History of active or inadequately treated latent tuberculosis (TB)<br><br> - Known or suspected systemic or skin autoimmune disorder other than pyoderma<br>   gangrenosum<br><br> - Any unstable major illness or evidence of unstable condition of major organ systems<br>   including psychiatric<br><br> - Cancer or history of lymphoproliferative disease within last 5 years; exception is<br>   cutaneous basal cell carcinoma or squamous cell carcinoma that has been treated.<br><br> - Major surgery within the last 4 weeks<br><br> - Live vaccines within the last 60 days<br><br> - Leukopenia (absolute WBC count < 3000/mm3); Lymphopenia (ALC < 500/mm3); Neutropenia<br>   (ANC < 1000/mm3)<br><br> - Thrombocytopenia (platelet count < 100,000/mm3; Anemia (hemoglobin < 9.0g/dL)<br><br> - ALT/AST > 3 X ULN and/or Total, unconjugated, and/or conjugated bilirubin > 2 X ULN<br>   within 28 days of dosing",,"Pyoderma Gangrenosum","Drug: Deucravacitinib","Change in Physician's Global Assessment (PGA);Change from baseline in ulcer size measured by calculating the area of the ulcers in centimeters squared using a digital application.","The percentage of patients needing rescue therapy from baseline to Day 115",STUDY02001753,"Please refer to primary and secondary sponsors","Bristol-Myers Squibb",,,,,,,,,,,,,,,,,,,Yes,False,"          "
ACTRN12623000211662,"18 September 2023","A Biomarker-Driven Approach to Identify Pathogenic Mechanisms and Novel Therapeutic Targets in Chronic Wounds (Pyoderma Gangrenosum) using Tildrakizumab","A Biomarker-Driven Approach to Identify Pathogenic Mechanisms and Novel Therapeutic Targets in Chronic Wounds (Pyoderma Gangrenosum) using Tildrakizumab                                                                                                                                                                                                                                                                                                                                                                                                                                                                                                                                                                                                                                                                                                                                                                                                                                                                                                                                                            ",,"Liverpool Hospital",28/02/2023,"  20230228","10/03/2025 17:03:09",ANZCTR,https://anzctr.org.au/ACTRN12623000211662.aspx,"Not Recruiting",No,"18 Years","99 Years","Both males and females",02/03/2023,10,Interventional,"Purpose: Treatment; Allocation: Non-randomised trial;","Phase 2",Australia,"Dr John Frew",,"Department of Dermatology,Liverpool Hospital Suite 7, Level 1, 45-47 Goulburn St Liverpool NSW 2170",john.frew@unsw.edu.au,"+61 2 87384560",,"Inclusion criteria: • Age greater than or equal to 18 years<br>• A minimum of one (1) active ulcer of Pyoderma Gangrenosum as determined by the PI<br> ","Exclusion criteria: Women lactating, pregnant or of childbearing potential who are not willing to avoid becoming pregnant during the study.<br>• Individuals with concurrent use of systemic antibiotics/ oral retinoids/ systemic immunosuppressants (those with prior use of these medications must have conducted a washout period of 4 weeks or 5 half-lives of the drug, whichever is longer).<br>• Any medical, psychological or social condition that, in the opinion of the Investigator, would jeopardize the health or well-being of the participant during any study procedures or the integrity of the data.<br>• Have received a vaccination with a live viral of bacterial component within 4 weeks or less of intended Tildrakizumab administration<br>• Patients not willing to abstain from receiving live vaccinations during treatment and for at least 17 weeks after treatment","Pyoderma Gangrenosum; <br>Pyoderma Gangrenosum;Inflammatory and Immune System - Other inflammatory or immune system disorders;Skin - Dermatological conditions","Tildrakizumab 200mg subcutaneous injection every 4 weeks, given via supervised injection in clinic for a total of 12 weeks.","Alterations in Gene Expression Profiling, cell counts (CD3+, CD11c+, Neutrophil Elastase+, CD20+, CD138+) at Week 12 compared to Baseline (composite primary outcome) using skin biopsy[ Week 12 post-first dose]","Safety and Tolerability (Grade 2/3 Adverse Effects); examples of known events include injection site reactions, upper respiratory tract infections. These will be assessed by history taking and clinical examination.[ Week 12 post first dose];Changes in Disease Activity (Measures by size of ulcer and global assessment VAS) using analysis of digital photographs[ Week 12 post first dose]","Nil Known","Sun Pharma",,Approved,26/10/2021,"South Western Sydney Local Health District ","Elizabeth St Liverpool NSW 2170",,,Yes,13/09/2023,,,10/08/2023,,,,,,No,,Yes,False,"          "
EUCTR2021-005754-28-IT,"16 December 2024","A double-blind, placebo-controlled, randomized withdrawal study of canakinumab in pyogenic sterile arthritis pyoderma gangrenosum and acne (PAPA) syndrome","A double-blind, placebo-controlled, randomized withdrawal study of canakinumab in pyogenic sterile arthritis pyoderma gangrenosum and acne (PAPA) syndrome - PAPA-Can study                                                                                                                                                                                                                                                                                                                                                                                                                                                                                                                                                                                                                                                                                                                                                                                                                                                                                                                                                   ",,"IRCCS ISTITUTO GIANNINA GASLINI",31/01/2023,"  20230131","10/03/2025 17:03:09","EU Clinical Trials Register",https://www.clinicaltrialsregister.eu/ctr-search/search?query=eudract_number:2021-005754-28,"Not Recruiting",Yes,,,"<br>Female: yes<br>Male: yes<br>",10/07/2023,24,"Interventional clinical trial of medicinal product","Controlled: yes Randomised: yes Open: no Single blind: no Double blind: yes Parallel group: yes Cross over: no Other: no If controlled, specify comparator, Other Medicinial Product: no Placebo: yes Other: no Number of treatment arms in the trial: 2 ","Human pharmacology (Phase I): no
Therapeutic exploratory (Phase II): no
Therapeutic confirmatory - (Phase III): yes
Therapeutic use (Phase IV): no
",Italy,"Mal. Autoinf. e Immunodeficienze",,"Via Gaslini, 5",printo@gaslini.org,+390104211018,"IRCCS Istituto Giannina Gaslini","Inclusion criteria: <br>1. Clinical diagnosis of PAPA with active flare at the time of enrolment.<br>2. Mutation of the PSTPIP1 gene.<br>Are the trial subjects under 18? yes<br>Number of subjects for this age range: <br>F.1.2 Adults (18-64 years) yes<br>F.1.2.1 Number of subjects for this age range 10<br>F.1.3 Elderly (>=65 years) yes<br>F.1.3.1 Number of subjects for this age range 2<br>","Exclusion criteria: <br>1.Use of the following therapies:<br>a.Corticosteroids (prednisone equivalent > 0.2 mg/kg/day [or greater than the maximum of 15 mg/ day for children over 60 kg]) within 1 week prior to Baseline<br>b.Anakinra within 72 hours prior to Baseline<br>c.Other biologics (including Canakinumab) or immunosuprassant 2 half-life prior to Baseline. <br>2.Any conditions or significant medical problems which in the opinion of the investigator immunocompromises the patient and/ or places the patient at unacceptable risk for immunomodulatory therapy<br>3.Live vaccinations within 3 months prior to the start of the trial, during the trial, and up to 3 months following the last dose<br>4. Pregnant or nursing women<br>5.Female adolescents (=18 years of age) of childbearing potential who do not agree to abstinence or, if sexually active, do not agree to the use of contraception .<br>","PAPA syndrome (Pyogenic Arthritis, Pyoderma gangrenosum and Acne) <br>MedDRA version: 20.0Level: LLTClassification code 10072225Term: PAPA syndromeSystem Organ Class: 100000004850 <br>MedDRA version: 20.0Level: LLTClassification code 10072225Term: PAPA syndromeSystem Organ Class: 100000004850 <br>MedDRA version: 20.0Level: LLTClassification code 10072225Term: PAPA syndromeSystem Organ Class: 100000004850 <br>MedDRA version: 20.0Level: LLTClassification code 10072225Term: PAPA syndromeSystem Organ Class: 100000004850;Therapeutic area: Diseases [C] - Immune System Diseases [C20]","<br>Product Name: Canakinumab<br>Product Code: [Canakinumab]<br>Pharmaceutical Form: Solution for injection<br>INN or Proposed INN: CANAKINUMAB<br>CAS Number: 914613-48-2<br>Current Sponsor code: ilaris, Canakinumab<br>Concentration unit: mg milligram(s)<br>Concentration type: up to<br>Concentration number: 450-<br>Pharmaceutical form of the placebo: Solution for injection<br>Route of administration of the placebo: Subcutaneous use<br><br>","Main Objective: To determine whether canakinumab administered every 4 weeks is able to maintain disease remission compared to placebo in canakinumab-responder patients;Secondary Objective: 1)To determine the efficacy of canakinumab to achieve a complete or almost complete response after 24 weeks <br>2)To evaluate optimal dose of canakinumab to induce disease remission<br>3)To assess the profile over time in each of the 4 key PAPA signs and symptoms (arthritis, foruncolosis, pyoderma gangrenosum, hydrosiadenite suppurativa) from baseline to end of study. <br>4)To assess the profile over time in physician’s and patients’s global assessment score from baseline to end of study.<br>5)To assess the profile over time in acute phase reactants (ESR, CRP, SAA) from baseline to end of study.;Primary end point(s): Proportion of patients not experiencing a disease flare in the treatment arm compared to the placebo arm at week 48.;Timepoint(s) of evaluation of this end point: 48 Weeks",,PAPA-Can,Novartis,,Approved,17/04/2023,,,,,,,,,,,,"No results available","No results available","No results available",,,Yes,"True ","parent    "
NL-OMON53965,"9 April 2024","Hyperbaric Oxygen Therapy for Pyoderma gangrenosum As a New Treatment Strategy","Hyperbaric Oxygen Therapy for Pyoderma gangrenosum As a New Treatment Strategy - HOT PANTS                                                                                                                                                                                                                                                                                                                                                                                                                                                                                                                                                                                                                                                                                                                                                                                                                                                                                                                                                                                           ",,"Erasmus MC, Universitair Medisch Centrum Rotterdam",13/07/2022,"  20220713","10/03/2025 17:03:09",NL-OMON,https://onderzoekmetmensen.nl/en/trial/53965,Recruiting,No,18,99,,13/03/2023,30,Interventional,"Non-randomized controlled trial, Open (masking not used), Other, Treatment",3,Netherlands,,,"Dr.Molewaterplein 40",,,"Erasmus MC, Universitair Medisch Centrum Rotterdam","Inclusion criteria: <p>• - Confirmed consensus on the diagnosis pyoderma gangrenosum by referring <br>specialist, principal and coordinating investigator (dermatologist, clinical <br>immunologist or rheumatologist based on PARACELSUS and Delphi score).<br>- Unsatisfactory response after six weeks of combined standard wound care and <br>systemic prednisone and/or other anti-inflammatory therapy.<br>- Fit for hyperbaric oxygen therapy as assessed by the hyperbaric physician.<br>- Age >=18 years at baseline<br>- All genders <br>- Able and willing to give written informed consent and to comply with the <br>study requirements.</p><br>","Exclusion criteria: <p>• Language barrier<br>• Unable to give informed consent <br>- Pregnancy</p><br>"," <br>Pyoderma gangrenosum; dermatitis ulcerosa;10027665;10040790","<p>30 sessions of HBO therapy at 2.4-2.5 atmosphere absolute in addition to <br>treatment conform clinical practice. Controls will be treated according to <br>clinical practice.</p><br>","<p>To assess the clinical effectiveness in wound healing time (full<br /><br>re-epithelialization) and to confirm the hypothesis the feasibility and<br /><br>possible efficacy of hyperbaric oxygen therapy in patients with pyoderma<br /><br>gangrenosum refractory to standard prednisone therapy.</p><br>","<p>- Changes in markers of inflammation, mRNA expression in micro-biopsies in<br /><br>wound edges.<br /><br>- Alterations in mitochondrial O2 levels<br /><br>- The number of activated neutrophils in peripheral venous blood.<br /><br>- To assess the effect of HBOT on Pain reduction (NRS score).<br /><br>- To assess the effect of HBOT on Health Related-Quality of Life (WOUND-Q).<br /><br>- To assess the prevalence of recurrence of PG in patients treated with and<br /><br>without adjuvant HBOT.</p><br>",EUCTR2021-006013-11-NL;NL80793.078.22,"Ministerie van OC&W",,Approved;Approved;Approved;Approved,13/07/2022;29/08/2022;21/04/2023;05/05/2023,;;;,;;;,;;;,;;;,,,,,,,,,,,,,Yes,False,"          "
NCT05343754,"30 September 2024","Hyperbaric Oxygen Therapy for Pyoderma Gangrenosum","Hyperbaric Oxygen Therapy for Pyoderma Gangrenosum As a New Treatment Strategy",HOTPANTS,"Erasmus Medical Center",11/04/2022,"  20220411","10/03/2025 17:03:09",ClinicalTrials.gov,https://clinicaltrials.gov/ct2/show/NCT05343754,"Not recruiting",No,"18 Years",N/A,All,01/06/2022,3,Interventional,"Allocation: Non-Randomized. Intervention model: Sequential Assignment. Primary purpose: Treatment. Masking: None (Open Label). ","Phase 3",Netherlands," ","Errol Prens, Prof.Dr.",,,,"Erasmus MC, dermatology department","Inclusion Criteria: -     - Confirmed consensus on the diagnosis pyoderma gangrenosum by referring     specialist, principal and coordinating investigator (dermatologist, clinical     immunologist or rheumatologist based on PARACELSUS and Delphi score). - Unsatisfactory response after six weeks of combined standard wound care and systemic   prednisone and/or other anti-inflammatory therapy. - Fit for hyperbaric oxygen therapy as assessed by the hyperbaric physician. - Age =18 years at baseline - All genders - Able and willing to give written informed consent and to comply with the study   requirements.Exclusion Criteria: -     - Language barrier - Unable to give informed consent or to comply with the trial protocol - Pregnancy",,"Pyoderma Gangrenosum","Drug: Hyperbaric oxygen;Other: Control group","Wound healing time","Cytokines changes;mitochondrial O2 levels;Neutrophil count in peripheral venous blood;pain dairy;quality of life measurement","NL 2021-006013-11","Please refer to primary and secondary sponsors",,,,,,,,,,,,,,,,,,,,Yes,False,"          "
NCT05120726,"3 June 2024","A Novel Therapeutic Treatment of Pyoderma Gangrenosum","A Novel Therapeutic Treatment of Pyoderma Gangrenosum",,"Louisiana State University Health Sciences Center in New Orleans",11/09/2021,"  20210911","10/03/2025 17:03:09",ClinicalTrials.gov,https://clinicaltrials.gov/ct2/show/NCT05120726,Recruiting,No,"18 Years",N/A,All,02/06/2021,20,Interventional,"Allocation: N/A. Intervention model: Single Group Assignment. Primary purpose: Treatment. Masking: None (Open Label). ","Phase 4","United States"," ; ","Alison Smith, MD, PhD;Alison Smith, MD, PhD",,;asmi60@lsuhsc.edu,;504-903-9009,"Louisiana State University Health Sciences Center - New Orleans;","<br>    Inclusion Criteria:<br><br>     - patients diagnosed with pyoderma gangrenosum<br><br>     - patients over 18 years of age<br><br>    Exclusion Criteria:<br><br>     - members of vulnerable populations (pregnant women and prisoners)<br><br>     - patients less than 18 years of age<br>   ",,"Pyoderma Gangrenosum","Biological: Dehydrated human amnion/chorion membrane","Gene Measurements;Wound Size","Infection;Pain Level","IRB: #1579","Please refer to primary and secondary sponsors",,,,,,,,,,,,,,,,,,,,No,False,"          "
NCT04895566,"27 March 2023","Phase 0/1 Local Application of the Monoclonal Antibody (Mab) sB24M in Patients With Purulent Pyoderma","Phase 0/1 Topical Application of the Monoclonal Antibody (Mab) sB24M in Patients With Severe Pyoderma",,"SWISS BIOPHARMA MED GmbH",17/05/2021,"  20210517","10/03/2025 17:03:09",ClinicalTrials.gov,https://clinicaltrials.gov/show/NCT04895566,"Not recruiting",No,"21 Years","80 Years",All,24/05/2021,10,Interventional,"Allocation: N/A. Intervention model: Single Group Assignment. Primary purpose: Treatment. Masking: None (Open Label). ","Early Phase 1",Belarus;Latvia;Belarus;Latvia,,,,,,,"<br>    Inclusion Criteria:<br><br>     - A confirmed severe form of any type of pyoderma with lesions of the skin and muscle<br>       tissue was diagnosed<br><br>     - Male or female, age = 21 years<br><br>     - Previous treatment with TNF antagonists (infliximab, adalimumab, etanercept,<br>       certolizumab, golimumab) ended no earlier than 30 days before starting therapy<br><br>     - Secondary treatment failure with up to one previous TNFa antagonist treatment (from<br>       the list above)<br><br>     - Secondary failure of corticosteroid treatment<br><br>     - Adequate hematologic, hepatic, and renal function<br><br>     - Written informed consent.<br><br>    Exclusion Criteria:<br><br>     - History of primary resistance or intolerance to any TNFa antagonist.<br><br>     - History of congestive heart failure or current, controlled or uncontrolled<br><br>     - Women who are pregnant or breastfeeding, or women of childbearing age if no effective<br>       method of contraception has been used during and for 3 months after the trial<br><br>     - Men, if no effective contraceptive method was used during the study and for 3 months<br>       afterward<br><br>     - Any prior exposure to Hu5F9-G4 or other CD47 targeting agents<br><br>     - Previous allogeneic stem cell transplant within 6 months prior to enrollment, active<br>       graft versus host disease (GVHD), or need for graft-associated immunosuppression<br><br>     - Refusal to sign the informed consent<br>   ",,"Pyoderma;Pyoderma Gangrenosum;Pyoderma Vegetans;Pyoderma Gangrenosum Surrounding Surgical Stoma","Biological: Monoclonal antibody (Mab) sB24M","Objective response rate (ORR) in patients with severe pyoderma","Duration of response (DoR) of patients with severe forms of pyoderma",SBPM0311m,"Please refer to primary and secondary sponsors",,,,,,,,,,,,,,,,,,,,Yes,False,"          "
