TrialID,"Last Refreshed on","Public title","Scientific title",Acronym,"Primary sponsor","Date registration","Date registration3","Export date","Source Register","web address","Recruitment Status","other records","Inclusion agemin","Inclusion agemax","Inclusion gender","Date enrollement","Target size","Study type","Study design",Phase,Countries,"Contact Firstname","Contact Lastname","Contact Address","Contact Email","Contact Tel","Contact Affiliation","Inclusion Criteria","Exclusion Criteria",Condition,Intervention,"Primary outcome","Secondary outcome","Secondary ID","Source Name","Secondary Sponsor","Ethics Status","Ethics Approval Date","Ethics Contact Name","Ethics Contact Address","Ethics Contact Phone","Ethics Contact Email","results yes no","results date posted","results url link","results url protocol","results date completed","results date first publication","results summary","results baseline char","results adverse events","results outcome measures","results ipd plan","results ipd description","Prospective registration","Bridging flag truefalse","Bridged type"
ChiCTR2500096782,"10 February 2025","A retrospective study of non-interventional multicenter data was conducted to describe the clinical characteristics, diagnostic criteria, and treatment needs of patients with pyoderma gangrenosum (PG)","A retrospective study of non-interventional multicenter data was conducted to describe the clinical characteristics, diagnostic criteria, and treatment needs of patients with pyoderma gangrenosum (PG)                                                                                                                                                                                                                                                                                                                                                                                                                                                                                                                                                                                                                                                                                                                                                                                                                                                                                                                                    ",,"The First Affiliated Hospital of Zhejiang University School of Medicine",06/02/2025,"  20250206","10/03/2025 17:03:09",ChiCTR,https://www.chictr.org.cn/showproj.html?proj=261071,Recruiting,No,0,100,Both,07/02/2025,"Cases group:100;","Observational study",Cross-sectional,"Retrospective study",China,"Jianjun Qiao Shan Fang",,"79 Qingchun Road, Hangzhou 310003, Zhejiang, China",qiaojianjun@126.com,"+86 137 3554 2393","The First Affiliated Hospital of Zhejiang University School of Medicine","Inclusion criteria: 1. Patients meeting the diagnostic criteria for pyoderma gangrenosum.<br>2. Patients who received treatment and follow-up.<br>3. Complete medical records and clinical data.","Exclusion criteria: 1. Patients with unclear diagnosis.<br>2. Patients with incomplete medical records and clinical data.","pyoderma gangrenosum","Cases group:None;","Diagnostic criteria;","Demographic characteristics;Treatment method;",,"National Natural Science Foundation of China",,Approved,06/12/2024,"lili li","79 Qingchun Road, Hangzhou 310003, Zhejiang, China","+86 571 8723 3418",,,,,,,,,,,,Yes,,Yes,False,"          "
CTIS2024-517155-13-00,"10 December 2024","A double-blind, placebo-controlled, randomized withdrawal study of canakinumab in pyogenic sterile arthritis pyoderma gangrenosum and acne (PAPA) syndrome","A double-blind, placebo-controlled, randomized withdrawal study of canakinumab in pyogenic sterile arthritis pyoderma gangrenosum and acne (PAPA) syndrome - PAPA-Can                                                                                                                                                                                                                                                                                                                                                                                                                                                                                                                                                                                                                                                                                                                                                                                                                                                                                                                                                      ",,"IRCCS Istituto Giannina Gaslini",04/09/2024,"  20240904","10/03/2025 17:03:09","Clinical Trials Information System",https://euclinicaltrials.eu/search-for-clinical-trials/?lang=en&EUCT=2024-517155-13-00,Recruiting,No,0,65+,"Female: yes Male: yes",01/01/1900,24,"Interventional clinical trial of medicinal product","Controlled: no Randomised: no Open: no Single blind: no Double blind: no Parallel group: no Cross over: no Other: no If controlled, specify comparator, Other Medicinial Product: no Placebo: no Number of treatment arms in the trial:","Human pharmacology (Phase I): No Therapeutic exploratory (Phase II): No Therapeutic confirmatory - (Phase III): Yes Therapeutic use - (Phase IV): No",Italy,"Marco Gattorno",,,marcogattorno@gaslini.org,003901056362793,"IRCCS Istituto Giannina Gaslini","Inclusion criteria: Clinical diagnosis of PAPA with active flare at the time of enrolment., Mutation of the PSTPIP1 gene., Patient’s written informed consent from those = 18 years of age must be obtained before any assessment is performed. Parent or legal guardian’s written informed consent and child’s assent, if appropriate, are required before any assessment is performed for patients < 18 years of age., Male and female patients.","Exclusion criteria: Use of the following therapies: a. Glucocorticoids (prednisone equivalent > 0.2 mg/kg/day [or greater than the maximum of 10 mg/ day for children over 60 kg]) within 1 week prior to Baseline b. Anakinra within 72 hours prior to Baseline c. Other biologics (including canakinumab) or immunosuppressants 2 half-life prior to Baseline., Female adolescents (=18 years of age) of childbearing potential who do not agree to abstinence or, if sexually active, do not agree to the use of contraception as defined in the exclusion criterion for women of child bearing potential., Women of child-bearing potential, defined as all women physiologically capable of becoming pregnant, unless they are using effective methods of contraception during dosing of study treatment., Known allergy or hypersensitivity to any component the IMP, History of malignancy of any organ system (other than localized basal cell carcinoma of the skin or in-situ cervical cancer), treated or untreated, within the past 5 years, regardless of whether there is evidence of local recurrence or metastases., Any conditions or significant medical problems which in the opinion of the investigator immunocompromises the patient and/ or places the patient at unacceptable risk for immunomodulatory therapy such as: a. Absolute neutrophil count <1.0 x 109/L or below b. Thrombocytopenia Platelets <10.0 x 109/L c. Any active or recurrent bacterial, fungal (with exception of onychomycosis) or viral infection. At least 1 month should elapse between the complete resolution of a severe infection, requiring hospitalization or systemic antibiotic therapy before the inclusion in the study d. Presence of Human Immunodeficiency Virus (HIV) infection, Hepatitis B (HBsAg) or Hepatitis C (HCV) infections based on screening lab results specific hepatitis serology that leads to exclusion. e. Clinical evidence or history of multiple sclerosis or other demyelinating diseases, or Felty’s syndrome, History or evidence of tuberculosis (TB) (active or latent) infection or one of the risk factors TB such as but not limited or exclusive to: a. History of any of the following: residence in a congregate setting (e.g. jail or prison, homeless shelter, or chronic care facility), substance abuse (e.g. injection or non-injection); health-care workers with unprotected exposure to patients who are at high risk of TB or patients with TB disease before the identification and correct airborne precautions of the patient, or b. Close contact (i.e. share the same air space in a household or other enclosed environment for a prolonged period (days or weeks, not minutes or hours) with a person with active pulmonary TB disease within the last year, or c. Evidence of TB infection (active or latent) determined by positive QuantiFERON (QFT-TB G In-Tube) test or positive Purified Protein Derivative (PPD) test (=5 mm induration) at screening or within 2 months prior to the screening visit, according to the national guidelines. If presence of TB infection (active or latent) is established then treatment for TB as per national guidelines must have been initiated or completed prior to randomization. In the absence of national guidelines, the following has been demonstrated: TB has been treated adequately by antibiotics, cure can be demonstrated and risk factors resulting in TB exposure and contracting have been removed., Elevated alanine aminotransferase (ALT) =3x ULN (if ALT at screening is >3x but <5x ULN, a re-test will be allowed. If ALT at ","PAPA syndrome;Therapeutic area: Diseases [C] - Immune System Diseases [C20]","Product Name: Placebo is solution for injection (150 mg/ml) contained in vials equal to those of Canakinumab and appears identical to the Test product. Placebo is provided by Novartis pharma., Product Code:N/A, Pharmaceutical Form: N/A, Other descriptive name: N/A , Strength: , Pharmaceutical form of the placebo: N/A , Product Name: Ilaris 150 mg/ml solution for injection, Product Code:PRD4821251, Pharmaceutical Form: SOLUTION FOR INJECTION, Other descriptive name: , Strength:",,,2021-005754-28,"Academic study; IMP donated by Novartis (Canakinumab) with a funding of 30.000 €",,Authorised,19/11/2024,,,,,,,,https://euclinicaltrials.eu/search-for-clinical-trials/?lang=en&EUCT=2024-517155-13-00,,,,,,,Yes,"Plan to produce publications on relevant national and international rheumatologic medical journals",Yes,False,"          "
CTIS2024-514306-31-00,"15 September 2025","A study to test whether spesolimab helps people with a skin condition called pyoderma gangrenosum","A multi-centre, randomised, placebo-controlled, double-blind, parallel-group trial to evaluate safety and efficacy of spesolimab (BI 655130) in adult patients with ulcerative pyoderma gangrenosum (PG) who require systemic therapy - 1368-0140                                                                                                                                                                                                                                                                                                                                                                                                                                                                                                                                                                                                                                                                                                                                                                                                                                                                                                                ",,"Boehringer Ingelheim International GmbH",29/08/2024,"  20240829","10/03/2025 17:03:09","Clinical Trials Information System",https://euclinicaltrials.eu/search-for-clinical-trials/?lang=en&EUCT=2024-514306-31-00,Recruiting,Yes,18,65+,"Female: yes Male: yes",19/03/2025,93,"Interventional clinical trial of medicinal product","Controlled: no Randomised: no Open: no Single blind: no Double blind: no Parallel group: no Cross over: no Other: no If controlled, specify comparator, Other Medicinial Product: no Placebo: no Number of treatment arms in the trial:","Human pharmacology (Phase I): No Therapeutic exploratory (Phase II): No Therapeutic confirmatory - (Phase III): Yes Therapeutic use - (Phase IV): No","Japan;Taiwan;Brazil;Argentina;United States;Switzerland;Malaysia;Canada;China;Australia;Austria;Belgium;Finland;France;Germany;Italy;Portugal;Spain;Sweden;Norway;Poland","CT Disclosure & Data Transparency",,,clintriage.rdg@boehringer-ingelheim.com,+498002430127,"Boehringer Ingelheim International GmbH","Inclusion criteria: Adult trial participants, aged =18 years (if local legislation for age of consent differs, then local legislation will be followed) at screening., Signed and dated written informed consent in accordance with International Council on Harmonisation-Good Clinical Practice (ICH-GCP) and local legislation prior to admission to the trial., A confirmed diagnosis of ulcerative pyoderma gangrenosum (PG) (=10 points on the PARACELSUS score) that requires systemic therapy in the opinion of the investigator. The diagnosis needs to be confirmed by an Adjudication Committee. Trial participants with mixed PG subtypes are eligible as long as the target lesion is of the ulcerative subtype., At least one measurable (defined as measuring =5 cm2) PG ulcer. In trial participants with more than one PG ulcer, the target PG ulcer will be selected by the investigator and confirmed by external Adjudication Committee., At the time of the Screening Visit, a maximum duration of 6 months since the target ulcer in the current PG episode was diagnosed. Target ulcers >6 months since diagnosis are allowed if they are active and progressing, as judged by the investigator and confirmed by an Adjudication Committee., Women of childbearing potential (WOCBP) must be ready and able to use highly effective methods of birth control per ICH M3 (R2) that result in a low failure rate of less than 1% per year when used consistently and correctly. A list of contraception methods meeting these criteria and instructions on the duration of use is provided in the participant information and in Section 4.2.2.3 of the protocol.","Exclusion criteria: Trial participants with non-PG lesions., Trial participants with a target PG ulcer measuring >80 cm2., Trial participants with chronic, non-inflamed PG wounds or ulcers that are not responsive to immunosuppressive therapy, as determined by an Adjudication Committee., Presence of active ulcer infection at the Screening Visit (unless treated and resolved prior to administration of the first dose of trial medication) based on investigator assessment., Presence of persistent or recurring bacterial infection requiring systemic antibiotic therapy; or clinically significant viral, fungal, or parasitic infections within 2 weeks prior to the Screening Visit. Any such infection must be resolved, with treatment completed =2 weeks prior to the Screening Visit. No new/recurrent infections should have occurred prior to Visit 2., Active or latent tuberculosis (TB) • Participants with active TB are excluded • Participants with latent TB may be included if treatment of latent TB, as per local guidelines, is initiated prior to randomization and completed during the course of the trial., Chronic or acute infections including Human immunodeficiency virus (HIV) infections and viral hepatitis (including occult hepatitis); the corresponding laboratory tests will be performed during screening. A trial participant can be re-screened if the trial participant was treated and is cured from the acute infection., Severe, progressive, or uncontrolled hepatic disease, defined as >3x Upper Limit of Normal (ULN) elevation in Aspartate aminotransferase (AST) or Alanine aminotransferase (ALT) or alkaline phosphatase, or >2x ULN elevation in total bilirubin., Further exclusion criteria apply.","Pyoderma gangrenosum;Therapeutic area: Diseases [C] - Skin and Connective Tissue Diseases [C17]","Product Name: , Product Code:PRD9853966, Pharmaceutical Form: SOLUTION FOR INFUSION, Other descriptive name: , Strength: , Product Name: Placebo matching to spesolimab, Product Code:N/A, Pharmaceutical Form: N/A, Other descriptive name: N/A , Strength: , Pharmaceutical form of the placebo: N/A","Main Objective: The primary objective is to demonstrate superiority of spesolimab over placebo in the difference in the proportion of trial participants with achievement of complete closure (100% pyoderma gangrenosum (PG) area reduction, PGAR-100) of the target PG ulcer at any time up to Week 26.;Secondary Objective: Secondary objectives are to demonstrate superiority of spesolimab against placebo for the (key) secondary endpoints.;Primary end point(s): Achievement of complete closure (PGAR-100 (100% pyoderma gangrenosum area reduction)) of the target PG ulcer at any time up to Week 26 and confirmed at the next consecutive visit (at least 2 weeks later)","Secondary end point(s):Key secondary endpoint: Achievement of PGAR-100 of the target PG ulcer at Week 26 confirmed at the next consecutive visit (at least 2 weeks later);Secondary end point(s):Achievement of 50% area reduction (PGAR-50) of the target PG ulcer at any time up to Week 26;Secondary end point(s):Achievement of = 3 point reduction in NRS Pain score from baseline at Week 26;Secondary end point(s):Achievement of a DLQI of = 5 at Week 26;Secondary end point(s):Achievement of PGAR-100 of any measurable PG ulcer (=5 cm2 at baseline) at any time up to Week 26 and confirmed at the next consecutive visit (at least 2 weeks later);Secondary end point(s):Achievement of PGAR-100 of all measurable PG ulcers (=5 cm2 at baseline) at any time up to Week 26 and confirmed at the next consecutive visit (at least 2 weeks later);Secondary end point(s):Time to recurrence among trial participants who had achieved complete response (CR, complete closure of all PG ulcers) at Week 26 up to Week 52. Recurrence is defined as emergence of the disease (PG ulcer[s]) at the previous ulcer sites(s) or emergence of any new PG ulcer(s)",U1111-1306-8055,,"Boehringer Ingelheim Espana S.A.",Authorised,18/12/2024,,,,,,,,https://euclinicaltrials.eu/search-for-clinical-trials/?lang=en&EUCT=2024-514306-31-00,,,,,,,Yes,"Researchers can use the following link https://www.mystudywindow.com/msw/datasharing to request access to the clinical study documents regarding this study, and upon a signed “Document Sharing Agreement”. Furthermore, researchers can request access to the clinical study data, for this and other listed studies, after the submission of a research proposal and according to the terms outlined on the website.Time Frame: One year after the approval has been granted by major Regulatory Authorities and after the primary manuscript has been accepted for publication, or after termination of the development program.Access Criteria: For study documents – upon signing of a ‚Document Sharing Agreement‘.For study data – 1. after the submission and approval of the research proposal (checks will be performed by the sponsor and/or the independent review panel, including checking that the planned analysis does not compete with sponsor's publication plan); 2. and upon signing of a legal agreement.",Yes,"True ","parent    "
